{
  "schema_version": 1,
  "skill_id": "appsdk-project-governance",
  "guidance_version": "1",
  "rules": [
    {"rule_id": "use-declared-sources", "severity": "forbidden", "description": "Read only rule sources declared by the project contract."},
    {"rule_id": "adjacent-transition", "severity": "forbidden", "description": "Execute only the projected node and adjacent workflow edges."},
    {"rule_id": "evidence-required", "severity": "forbidden", "description": "A passing required step must bind evidence."},
    {"rule_id": "context-drift", "severity": "forbidden", "description": "Revise the plan after project, goal, source, scope, owner, or rule-context drift."},
    {"rule_id": "append-only-history", "severity": "forbidden", "description": "Do not overwrite or delete plan revisions and execution events."},
    {"rule_id": "lifecycle-truth", "severity": "forbidden", "description": "Do not claim lifecycle completion before canonical AppSDK gates pass."},
    {"rule_id": "changed-scope-control-truth", "severity": "forbidden", "description": "New or changed control and configuration behavior must use declared typed control resources, error chains, or project configuration sources, never payloads, metadata, debug logs, or implicit context."},
    {"rule_id": "changed-scope-single-owner", "severity": "forbidden", "description": "New or changed behavior must retain one semantic owner and one implementation, with no duplicate path, fallback, or temporary bypass."},
    {"rule_id": "changed-scope-configured-orchestration", "severity": "forbidden", "description": "Preserve fixed operation/hook/gate boundaries only where the project declares them. Missing required capabilities fail explicitly; never mock success."},
    {"rule_id": "changed-scope-ablation-and-sharing", "severity": "advisory", "description": "Compare deletion, reuse and direct implementation by actual complexity. Optional simplification does not block; concrete quality, safety or ownership regressions remain forbidden."},
    {"rule_id": "historical-architecture-debt", "severity": "advisory", "description": "Report untouched historical violations as recommendations; do not block the candidate unless they enter changed scope or affect safety, ownership, evidence truth, or required delivery."},
    {"rule_id": "project-context-binding", "severity": "warning", "description": "Locate feature and debug work in the declared function and verification maps before implementation."},
    {"rule_id": "debug-notes-required", "severity": "warning", "description": "During debug exploration, append observations, hypotheses, and evidence to the active run notes before resolution."},
    {"rule_id": "map-gate-update", "severity": "advisory", "description": "Update function ownership and verification gates in the same change when the implementation changes them."},
    {"rule_id": "recommended-design", "severity": "warning", "description": "Record requirement, architecture, and detailed-design closure before feature implementation."},
    {"rule_id": "prior-record-search", "severity": "advisory", "description": "Check prior verified successes and failures before repeating exploration."}
  ],
  "workflows": [
    {
      "domain": "bootstrap",
      "objective": "Enter AppSDK governance without destroying existing project truth.",
      "entry_node": "prepare",
      "nodes": [
        {"node_id": "prepare", "instruction": "Run prepare and confirm scope, roots, boundaries, and acceptance.", "owner": "project", "evidence": ["preparation-record"]},
        {"node_id": "initialize", "instruction": "Run idempotent initialization for the confirmed project root.", "owner": "project", "evidence": ["initialized-layout"]},
        {"node_id": "baseline_verify", "instruction": "Verify the initialized governance baseline.", "owner": "project", "evidence": ["verify-result"]}
      ],
      "edges": [{"from": "prepare", "to": "initialize"}, {"from": "initialize", "to": "baseline_verify"}]
    },
    {
      "domain": "migration",
      "objective": "Reconcile or reset legacy governance through an explicit, auditable route.",
      "entry_node": "inspect_legacy",
      "nodes": [
        {"node_id": "inspect_legacy", "instruction": "Inventory old governance truth and disposable runtime state.", "owner": "project", "evidence": ["legacy-inventory"]},
        {"node_id": "choose_route", "instruction": "Choose preserve-and-migrate or the explicitly authorized clean-epoch reset for each named control-plane owner.", "owner": "project", "evidence": ["migration-route"]},
        {"node_id": "apply_route", "instruction": "Execute the canonical AppSDK migration/reset and the separate Collab migration/reset through their respective owners; never substitute one transaction for the other.", "owner": "project", "evidence": ["migration-record"]},
        {"node_id": "migration_verify", "instruction": "Verify the resulting single governance truth.", "owner": "project", "evidence": ["verify-result"]}
      ],
      "edges": [{"from": "inspect_legacy", "to": "choose_route"}, {"from": "choose_route", "to": "apply_route"}, {"from": "apply_route", "to": "migration_verify"}]
    },
    {
      "domain": "governance-preflight",
      "objective": "Bind goal, module, owner, maps, worktree, and required gates before code work.",
      "entry_node": "goal_scope",
      "nodes": [
        {"node_id": "goal_scope", "instruction": "Confirm objective, scope, acceptance, non-goals, and owner.", "owner": "project", "evidence": ["goal-record"]},
        {"node_id": "architecture_maps", "instruction": "Bind resource, function, mainline, verification, and module maps.", "owner": "project", "evidence": ["map-check"]},
        {"node_id": "owner_worktree", "instruction": "Create the clean owner worktree from latest origin/main.", "owner": "project", "evidence": ["worktree-record"]},
        {"node_id": "preflight_verify", "instruction": "Run the applicable AppSDK and project preflight checks.", "owner": "project", "evidence": ["verify-result"]}
      ],
      "edges": [{"from": "goal_scope", "to": "architecture_maps"}, {"from": "architecture_maps", "to": "owner_worktree"}, {"from": "owner_worktree", "to": "preflight_verify"}]
    },
    {
      "domain": "develop",
      "objective": "Develop features through project context, proportionate design, exact validation, and verified cleanup.",
      "entry_node": "requirements",
      "nodes": [
        {"node_id": "requirements", "instruction": "Define the user-visible contract, scope, non-goals, acceptance, and required evidence; reuse an existing confirmed decision when present.", "owner": "project", "evidence": ["requirements"]},
        {"node_id": "map_check", "instruction": "Read the declared function and verification maps, bind the owner, allowed and forbidden paths, required gates, and prior records, and note any map entry that the change must add.", "owner": "project", "evidence": ["function-map-binding", "verification-map-binding"]},
        {"node_id": "architecture", "instruction": "For a new project or meaningful cross-module or semantic change, close top-down modules, resources, boundaries, and mainline flow; otherwise record why existing architecture is sufficient.", "owner": "project", "evidence": ["architecture-design"]},
        {"node_id": "detailed_design", "instruction": "When the change introduces non-trivial behavior, close calls, data, errors, and verification mapping before implementation.", "owner": "project", "evidence": ["detailed-design"]},
        {"node_id": "implementation", "instruction": "Implement the smallest change through the mapped owner in a clean owner worktree.", "owner": "project", "evidence": ["source-diff", "worktree-record"]},
        {"node_id": "candidate", "instruction": "Create and bind the exact candidate commit and tree.", "owner": "project", "evidence": ["candidate-record"]},
        {"node_id": "validation", "instruction": "Run focused tests and mapped gates, then add build, install, restart, and same-entry replay only when the change affects those surfaces.", "owner": "project", "evidence": ["validation-record"]},
        {"node_id": "map_update", "instruction": "Update declared function ownership, paths, call edges, and verification gates when the validated change altered them.", "owner": "project", "evidence": ["function-map-binding", "verification-map-binding"]},
        {"node_id": "review", "instruction": "Review the validated candidate against applicable quality, safety, evidence and owner contracts. Block concrete regressions; optional simplification and unrelated historical debt are advisory.", "owner": "project", "evidence": ["architecture-conformance", "review-record"], "reminders": [{"kind": "memory_review", "blocking": false, "command": "project-memory review --run <run-id>"}]},
        {"node_id": "effectiveness", "instruction": "Check effectiveness identity and freshness; reuse valid unchanged candidate evidence and rerun only affected checks on drift.", "owner": "project", "evidence": ["effectiveness-record"]},
        {"node_id": "integration", "instruction": "Integrate on latest main and verify the exact integration tree.", "owner": "project", "evidence": ["mainline-receipt"]},
        {"node_id": "promotion", "instruction": "Compile, publish Active, archive Protected, and freeze when required.", "owner": "project", "evidence": ["freeze-record"]},
        {"node_id": "cleanup", "instruction": "Record actual retained resources and owner or verified authorized removal. Delivery can complete with retention; do not claim Collab resource close before its cleanup requirements pass.", "owner": "project", "evidence": ["cleanup-record"]}
      ],
      "edges": [
        {"from": "requirements", "to": "map_check"},
        {"from": "map_check", "to": "architecture"}, {"from": "map_check", "to": "implementation"},